,country,region_1,variety,points_median,location,address,point,latitude,longitude,altitude
748,Italy,Riviera Ligure di Ponente,Vermentino,85.0,"Riviera Ligure di Ponente, Italy","Banco di Chiavari e della Riviera Ligure, Via Maria Ausiliatrice, Borgo Foce, Ponente, Genova, Liguria, 16157, Italia","(44.4270691, 8.7868476, 0.0)",44.4270691,8.7868476,0.0
749,Italy,Roccamonfina,Red Blend,89.0,"Roccamonfina, Italy","Roccamonfina, Caserta, Campania, 81035, Italia","(41.2884039, 13.9828383, 0.0)",41.2884039,13.9828383,0.0
750,Italy,Roero,Nebbiolo,88.0,"Roero, Italy","Roro, Sant'Orsola Terme, Comunità Alta Valsugana e Bersntol, Provincia di Trento, Trentino-Alto Adige/Südtirol, 38043, Italia","(46.1127081, 11.3064236, 0.0)",46.1127081,11.3064236,0.0
751,Italy,Roero Arneis,Arneis,86.0,"Roero Arneis, Italy",,,,,
752,Italy,Romagna,Sparkling Blend,89.0,"Romagna, Italy","Romagna, Modigliana, Unione di Comuni della Romagna Forlivese, Forlì-Cesena, Emilia-Romagna, 47015, Italia","(44.13497265, 11.847319102240142, 0.0)",44.13497265,11.847319102240142,0.0
753,Italy,Rosazzo,White Blend,90.0,"Rosazzo, Italy","Corno di Rosazzo, UTI del Natisone, Friuli Venezia Giulia, 33040, Italia","(45.9970608, 13.4415949, 0.0)",45.9970608,13.4415949,0.0
754,Italy,Rosso Conero,Red Blend,86.0,"Rosso Conero, Italy","Agriturismo Rosso Conero, Frazione Varano, Trave, Ancona, Marche, 60129, Italia","(43.5698808, 13.5513259, 0.0)",43.5698808,13.5513259,0.0
755,Italy,Rosso Piceno,Red Blend,86.0,"Rosso Piceno, Italy","Tempietto di Sant'Emidio Rosso, Via Berardo Tucci, Borgo Solestà, Ascoli Piceno, Marche, 63100, Italia","(42.859876799999995, 13.57036, 0.0)",42.859876799999995,13.57036,0.0
756,Italy,Rosso Piceno Superiore,Red Blend,86.0,"Rosso Piceno Superiore, Italy","Strada Provinciale 1 Rosso Piceno Superiore, Valle Apparignano, Acquaviva Picena, Ascoli Piceno, Marche, 63073, Italia","(42.9551415, 13.7559162, 0.0)",42.9551415,13.7559162,0.0
757,Italy,Rosso del Veronese,Red Blend,91.0,"Rosso del Veronese, Italy","Sengio Rosso, Caprino Veronese, Verona, Veneto, 37013, Italia","(45.6286888, 10.8083183, 0.0)",45.6286888,10.8083183,0.0
758,Italy,Rosso di Cerignola,Red Blend,90.0,"Rosso di Cerignola, Italy","Dado rosso, Via Fratelli Rosselli, Cerignola, Foggia, Puglia, 71042, Italia","(41.2628863, 15.900476, 0.0)",41.2628863,15.900476,0.0
759,Italy,Rosso di Montalcino,Sangiovese Grosso,88.0,"Rosso di Montalcino, Italy","Fosso della Fonte al Rosso, Podere Galampio, Montalcino, Siena, Toscana, Italia","(43.0546099, 11.3622147, 0.0)",43.0546099,11.3622147,0.0
760,Italy,Rosso di Montepulciano,Sangiovese,88.0,"Rosso di Montepulciano, Italy",,,,,
761,Italy,Rosso di Toscana,Sangiovese,88.5,"Rosso di Toscana, Italy","Rosso, Podere Alteta, San Quirico d'Orcia, Unione dei Comuni Amiata Val d'Orcia, Siena, Toscana, Italia","(43.0573443, 11.608908449999994, 0.0)",43.0573443,11.608908449999994,0.0
762,Italy,Rubicone,White Blend,88.0,"Rubicone, Italy","Rubicone, Unione Rubicone e mare, Forlì-Cesena, Emilia-Romagna, 47043, Italia","(44.0933443, 12.3960576, 0.0)",44.0933443,12.3960576,0.0
763,Italy,Ruché di Castagnole Monferrato,Ruché,87.0,"Ruché di Castagnole Monferrato, Italy",,,,,
764,Italy,Sagrantino di Montefalco,Sagrantino,90.0,"Sagrantino di Montefalco, Italy",,,,,
765,Italy,Salento,White Blend,90.0,"Salento, Italy","Salento, Salerno, Campania, Italia","(40.248604, 15.190058, 0.0)",40.248604,15.190058,0.0
766,Italy,Salice Salentino,Red Blend,87.0,"Salice Salentino, Italy","Salice Salentino, Lecce, Puglia, 73015, Italia","(40.3856618, 17.9637483, 0.0)",40.3856618,17.9637483,0.0
767,Italy,Salina,Red Blend,91.5,"Salina, Italy","Isola di Salina, Leni, Messina, Sicilia, Italia","(38.55904115, 14.83589060715635, 0.0)",38.55904115,14.83589060715635,0.0
768,Italy,San Gimignano,Vernaccia,86.5,"San Gimignano, Italy","San Gimignano, Piazza Duomo, Santa Chiara, San Gimignano, Siena, Toscana, 53037, Italia","(43.4677993, 11.0432115, 0.0)",43.4677993,11.0432115,0.0
769,Italy,San Marino,Biancale,85.0,"San Marino, Italy","San Marino, Vicenza, Veneto, 36052, Italia","(45.8983636, 11.6927814, 0.0)",45.8983636,11.6927814,0.0
770,Italy,San Martino della Battaglia,Friulano,87.0,"San Martino della Battaglia, Italy","San Martino della Battaglia, Desenzano del Garda, Brescia, Lombardia, 25105, Italia","(45.4386066, 10.5979325, 0.0)",45.4386066,10.5979325,0.0
771,Italy,Sangiovese di Romagna,Sangiovese,87.0,"Sangiovese di Romagna, Italy","Viale Sangiovese, San Lorenzo in Strada, Riccione, Rimini, Emilia-Romagna, 47838, Italia","(44.0032924, 12.6202553, 0.0)",44.0032924,12.6202553,0.0
772,Italy,Sangiovese di Romagna Superiore,Sangiovese,86.5,"Sangiovese di Romagna Superiore, Italy",,,,,
773,Italy,Sannio,Piedirosso,90.0,"Sannio, Italy","San Giorgio del Sannio, Benevento, Campania, Italia","(41.0693267, 14.8524578, 0.0)",41.0693267,14.8524578,0.0
774,Italy,Sant' Agata dei Goti,Aglianico,90.0,"Sant' Agata dei Goti, Italy",,,,,
775,Italy,Sant'Antimo,Syrah,91.5,"Sant'Antimo, Italy","Sant'Antimo, Napoli, Campania, 80029, Italia","(40.945711, 14.231429, 0.0)",40.945711,14.231429,0.0
776,Italy,Sardinia,White Blend,88.0,"Sardinia, Italy","Sardegna, Austis, Nuoro, Sardegna, 08030, Italia","(40.06160405, 9.097753806553065, 0.0)",40.06160405,9.097753806553065,0.0
777,Italy,Sebino,Red Blend,83.0,"Sebino, Italy","Lago d'Iseo, Bergamo, Lombardia, Italia","(45.7388781, 10.07086612061877, 0.0)",45.7388781,10.07086612061877,0.0
778,Italy,Sforzato di Valtellina,Nebbiolo,90.0,"Sforzato di Valtellina, Italy",,,,,
779,Italy,Sicilia,Zibibbo,92.0,"Sicilia, Italy","Sicilia, Italia","(37.587794, 14.155048, 0.0)",37.587794,14.155048,0.0
780,Italy,Siracusa,Moscato,88.5,"Siracusa, Italy","Siracusa, Sicilia, Italia","(37.0646139, 15.2907196, 0.0)",37.0646139,15.2907196,0.0
781,Italy,Soave,White Blend,87.0,"Soave, Italy","Soave, Verona, Veneto, 37038, Italia","(45.4202303, 11.247722, 0.0)",45.4202303,11.247722,0.0
782,Italy,Soave Classico,White Blend,88.5,"Soave Classico, Italy",,,,,
783,Italy,Soave Classico Superiore,White Blend,89.0,"Soave Classico Superiore, Italy",,,,,
784,Italy,Soave Colli Scaligeri,White Blend,87.0,"Soave Colli Scaligeri, Italy",,,,,
785,Italy,Soave Superiore,White Blend,89.0,"Soave Superiore, Italy","Giardini Francesco Soave, Borgo, Val Polcevera, Genova, Liguria, Italia","(44.5000737, 8.90338153453787, 0.0)",44.5000737,8.90338153453787,0.0
786,Italy,Sovana,Red Blend,87.0,"Sovana, Italy","Sovana, Sorano, Unione di Comuni Montani Colline del Fiora, Grosseto, Toscana, Italia","(42.6570045, 11.6465486, 0.0)",42.6570045,11.6465486,0.0
787,Italy,Squinzano,Red Blend,86.0,"Squinzano, Italy","Squinzano, Lecce, Puglia, 73018, Italia","(40.436528, 18.04182, 0.0)",40.436528,18.04182,0.0
788,Italy,Strevi,Moscato,89.0,"Strevi, Italy","Strevi, Alessandria, Piemonte, 15019, Italia","(44.698146, 8.521847, 0.0)",44.698146,8.521847,0.0
789,Italy,Taburno,Red Blend,92.0,"Taburno, Italy","Campoli del Monte Taburno, Benevento, Campania, Italia","(41.131518, 14.645935, 0.0)",41.131518,14.645935,0.0
790,Italy,Tarantino,Susumaniello,86.0,"Tarantino, Italy","Tarantino, Vico dei Costanzi, Rione Carità, Municipalità 2, Napoli, Campania, 80138, Italia","(40.8456556, 14.2589112, 0.0)",40.8456556,14.2589112,0.0
791,Italy,Taurasi,Red Blend,91.0,"Taurasi, Italy","Taurasi, Avellino, Campania, Italia","(41.008718, 14.958644, 0.0)",41.008718,14.958644,0.0
792,Italy,Teroldego Rotaliano,Teroldego,88.0,"Teroldego Rotaliano, Italy",,,,,
793,Italy,Terra degli Osci,Sangiovese,88.0,"Terra degli Osci, Italy",,,,,
794,Italy,Terrazze Retiche di Sondrio,White Blend,89.0,"Terrazze Retiche di Sondrio, Italy",,,,,
795,Italy,Terre Siciliane,Zibibbo,92.0,"Terre Siciliane, Italy",,,,,
796,Italy,Terre del Volturno,Red Blend,90.0,"Terre del Volturno, Italy",,,,,
797,Italy,Terre di Chieti,Sangiovese,87.0,"Terre di Chieti, Italy",,,,,
798,Italy,Terre di Franciacorta,Chardonnay,88.5,"Terre di Franciacorta, Italy","Residence Terre di Franciacorta, Padergnone, Rodengo Saiano, Brescia, Lombardia, Italia","(45.59955195, 10.106685764146746, 0.0)",45.59955195,10.106685764146746,0.0
799,Italy,Torgiano,White Blend,91.5,"Torgiano, Italy","Torgiano, Perugia, Umbria, 06089, Italia","(43.028542, 12.44136, 0.0)",43.028542,12.44136,0.0
800,Italy,Torgiano Rosso Riserva,Red Blend,92.0,"Torgiano Rosso Riserva, Italy",,,,,
801,Italy,Toscana,White Blend,92.0,"Toscana, Italy","Toscana, Italia","(43.4586541, 11.1389204, 0.0)",43.4586541,11.1389204,0.0
802,Italy,Trebbiano d'Abruzzo,Trebbiano,86.0,"Trebbiano d'Abruzzo, Italy",,,,,
803,Italy,Trentino,White Blend,89.0,"Trentino, Italy","Provincia di Trento, Trentino-Alto Adige/Südtirol, Italia","(46.102817, 11.129543099871789, 0.0)",46.102817,11.129543099871789,0.0
804,Italy,Trentino Superiore,Müller-Thurgau,88.0,"Trentino Superiore, Italy",,,,,
805,Italy,Trento,Sparkling Blend,91.5,"Trento, Italy","Trento, Territorio Val d'Adige, Provincia di Trento, Trentino-Alto Adige/Südtirol, Italia","(46.0664228, 11.1257601, 0.0)",46.0664228,11.1257601,0.0
806,Italy,Tuscany,Red Blend,90.0,"Tuscany, Italy","Toscana, Italia","(43.4586541, 11.1389204, 0.0)",43.4586541,11.1389204,0.0
807,Italy,Umbria,White Blend,92.0,"Umbria, Italy","Umbria, Italia","(42.965916, 12.490236, 0.0)",42.965916,12.490236,0.0
808,Italy,Val di Cornia Suvereto,Vermentino,92.0,"Val di Cornia Suvereto, Italy","Via Val di Cornia, San Rocco, Suvereto, Livorno, Toscana, 57021, Italia","(43.0746244, 10.6767865, 0.0)",43.0746244,10.6767865,0.0
809,Italy,Val di Neto,White Blend,90.0,"Val di Neto, Italy","Ali Val di Neto, Strada Statale 106 Jonica, Bucchi, Crotone, Calabria, Italia","(39.184734649999996, 17.10703449565607, 0.0)",39.184734649999996,17.10703449565607,0.0
810,Italy,Valdadige,Pinot Grigio,88.0,"Valdadige, Italy","Cantina Valdadige, Via Don Cesare Scala, Pian di Festa, Brentino Belluno, Verona, Veneto, Italia","(45.659754, 10.8950331, 0.0)",45.659754,10.8950331,0.0
811,Italy,Valdobbiadene Prosecco Superiore,White Blend,90.0,"Valdobbiadene Prosecco Superiore, Italy",,,,,
812,Italy,Valdobbiadene Superiore di Cartizze,Glera,89.0,"Valdobbiadene Superiore di Cartizze, Italy",,,,,
813,Italy,Valle d'Aosta,Red Blend,90.0,"Valle d'Aosta, Italy","Valle d'Aosta/Vallée d'Aoste, Italia","(45.730099, 7.387426, 0.0)",45.730099,7.387426,0.0
814,Italy,Valli di Porto Pino,White Blend,89.0,"Valli di Porto Pino, Italy",,,,,
815,Italy,Valpolicella,Red Blend,87.0,"Valpolicella, Italy","Negrar di Valpolicella, Verona, Veneto, 37024, Italia","(45.5296706, 10.9400217, 0.0)",45.5296706,10.9400217,0.0
816,Italy,Valpolicella Classico,Red Blend,88.5,"Valpolicella Classico, Italy",,,,,
817,Italy,Valpolicella Classico Superiore,Red Blend,87.0,"Valpolicella Classico Superiore, Italy",,,,,
818,Italy,Valpolicella Classico Superiore Ripasso,Red Blend,88.0,"Valpolicella Classico Superiore Ripasso, Italy",,,,,
819,Italy,Valpolicella Ripasso,Red Blend,87.0,"Valpolicella Ripasso, Italy",,,,,
820,Italy,Valpolicella Ripasso Classico,Red Blend,89.0,"Valpolicella Ripasso Classico, Italy",,,,,
821,Italy,Valpolicella Ripasso Valpantena,"Corvina, Rondinella, Molinara",87.0,"Valpolicella Ripasso Valpantena, Italy",,,,,
822,Italy,Valpolicella Ripasso Valpantena Superiore,Red Blend,87.0,"Valpolicella Ripasso Valpantena Superiore, Italy",,,,,
823,Italy,Valpolicella Superiore,Red Blend,87.0,"Valpolicella Superiore, Italy",,,,,
824,Italy,Valpolicella Superiore Ripasso,Red Blend,88.0,"Valpolicella Superiore Ripasso, Italy",,,,,
825,Italy,Valpolicella Valpantena,"Corvina, Rondinella, Molinara",87.0,"Valpolicella Valpantena, Italy",,,,,
826,Italy,Valtellina,White Blend,87.5,"Valtellina, Italy","Valtellina, Arzuga, Grosio, Comunità Montana della Valtellina di Tirano, Sondrio, Lombardia, Italia","(46.32336235, 10.258413671017703, 0.0)",46.32336235,10.258413671017703,0.0
827,Italy,Valtellina Superiore,Red Blend,90.0,"Valtellina Superiore, Italy","Sentiero Valtellina, Posseggia, Teglio, Comunità Montana della Valtellina di Tirano, Sondrio, Lombardia, 23036, Italia","(46.158326, 10.0373383, 0.0)",46.158326,10.0373383,0.0
828,Italy,Valtènesi,Rosato,86.5,"Valtènesi, Italy","Via Valtenesi, Vicina, Desenzano del Garda, Brescia, Lombardia, 25150, Italia","(45.4882443, 10.5278778, 0.0)",45.4882443,10.5278778,0.0
829,Italy,Veneto,White Blend,90.0,"Veneto, Italy","Veneto, Italia","(45.6476663, 11.8665254, 0.0)",45.6476663,11.8665254,0.0
830,Italy,Veneto Orientale,Red Blend,92.0,"Veneto Orientale, Italy","CTVO Consorzio Taxi Veneto Orientale, Via don Guerrino Bertolin, Laguna Shopping, Jesolo, Venezia, Veneto, 30016, Italia","(45.508348, 12.6389608, 0.0)",45.508348,12.6389608,0.0
831,Italy,Venezia,Pinot Grigio,85.0,"Venezia, Italy","Venezia, Veneto, Italia","(45.4371908, 12.3345898, 0.0)",45.4371908,12.3345898,0.0
832,Italy,Venezia Giulia,White Blend,92.0,"Venezia Giulia, Italy","Venezia Giulia, Savena, Bologna, Emilia-Romagna, 40139, Italia","(44.4785765, 11.3815621, 0.0)",44.4785765,11.3815621,0.0
833,Italy,Venezie,White Blend,88.0,"Venezie, Italy","Istituto Zooprofilattico Sperimentale delle Venezie, Legnaro, Padova, Veneto, Italia","(45.34851865, 11.957179705362917, 0.0)",45.34851865,11.957179705362917,0.0
834,Italy,Verdicchio dei Castelli di Jesi,Verdicchio,87.0,"Verdicchio dei Castelli di Jesi, Italy",,,,,
835,Italy,Verdicchio dei Castelli di Jesi Classico,White Blend,90.0,"Verdicchio dei Castelli di Jesi Classico, Italy",,,,,
836,Italy,Verdicchio dei Castelli di Jesi Classico Superiore,White Blend,88.0,"Verdicchio dei Castelli di Jesi Classico Superiore, Italy",,,,,
837,Italy,Verdicchio di Matelica,Verdicchio,88.0,"Verdicchio di Matelica, Italy","Fettucciato G.F.Verdicchio, Matelica, Macerata, Marche, Italia","(43.2185295, 12.9872027, 0.0)",43.2185295,12.9872027,0.0
838,Italy,Vermentino di Gallura,Vermentino,89.5,"Vermentino di Gallura, Italy",,,,,
839,Italy,Vermentino di Sardegna,Vermentino,88.0,"Vermentino di Sardegna, Italy","Strada del Vermentino, Belchidda/Berchidda, Sassari, Sardegna, Italia","(40.7675184, 9.1595022, 0.0)",40.7675184,9.1595022,0.0
840,Italy,Vernaccia di San Gimignano,White Blend,89.0,"Vernaccia di San Gimignano, Italy",,,,,
841,Italy,Veronese,White Blend,93.0,"Veronese, Italy","Veronese, Via Lanzo, Barriera di Lanzo, Torino, Provincia di Torino, Piemonte, 10148, Italia","(45.1123339, 7.6597528, 0.0)",45.1123339,7.6597528,0.0
842,Italy,Vesuvio,Red Blend,92.0,"Vesuvio, Italy","Vesuvio, Ercolano, Napoli, Campania, 80040, Italia","(40.8214568, 14.4258161, 0.0)",40.8214568,14.4258161,0.0
843,Italy,Vigneti delle Dolomiti,White Blend,92.0,"Vigneti delle Dolomiti, Italy",,,,,
844,Italy,Vin Santo del Chianti,White Blend,93.0,"Vin Santo del Chianti, Italy",,,,,
845,Italy,Vin Santo del Chianti Classico,White Blend,92.0,"Vin Santo del Chianti Classico, Italy",,,,,
846,Italy,Vin Santo del Chianti Rufina,White Blend,90.0,"Vin Santo del Chianti Rufina, Italy",,,,,
847,Italy,Vin Santo di Carmignano,White Blend,89.0,"Vin Santo di Carmignano, Italy",,,,,
848,Italy,Vin Santo di Montepulciano,White Blend,99.5,"Vin Santo di Montepulciano, Italy",,,,,
849,Italy,Vino Nobile di Montepulciano,Sangiovese,90.0,"Vino Nobile di Montepulciano, Italy",,,,,
850,Italy,Vino Spumante,Trebbiano,93.0,"Vino Spumante, Italy",,,,,
851,Italy,Vino da Tavola,White Blend,92.0,"Vino da Tavola, Italy","La Tavola, il vino e la dispensa, 36, Via Giovanni Giolitti, Rione XV Esquilino, Municipio Roma I, Roma, Roma Capitale, Lazio, 00185, Italia","(41.8988768, 12.5035512, 0.0)",41.8988768,12.5035512,0.0
852,Italy,Vittoria,Red Blend,95.0,"Vittoria, Italy","Vittoria, Ragusa, Sicilia, 97019, Italia","(36.9514957, 14.5304867, 0.0)",36.9514957,14.5304867,0.0
853,Italy,Vittoria Frappato,Frappato,86.5,"Vittoria Frappato, Italy","Via del Frappato di Vittoria, Borgo Fontana Volpe, Vittoria, Ragusa, Sicilia, 97019, Italia","(36.9809772, 14.5505655, 0.0)",36.9809772,14.5505655,0.0
854,Spain,Alella,White Blend,89.5,"Alella, Spain","Alella, Maresme, Barcelona, Catalunya, 08328, España","(41.4952867, 2.2942758, 0.0)",41.4952867,2.2942758,0.0
855,Spain,Alicante,White Blend,91.0,"Alicante, Spain","Alacant / Alicante, l'Alacantí, Alacant / Alicante, Comunitat Valenciana, España","(38.353738, -0.4901846, 0.0)",38.353738,-0.4901846,0.0
856,Spain,Almansa,White Blend,88.0,"Almansa, Spain","Almansa, Albacete, Castilla-La Mancha, 02640, España","(38.8682065, -1.0978627, 0.0)",38.8682065,-1.0978627,0.0
857,Spain,Arribes del Duero,Tempranillo,89.0,"Arribes del Duero, Spain","Arribes del Duero, 11, Avinguda de la Generalitat, Santa Coloma de Gramenet, Barcelonès, Barcelona, Catalunya, 08922, España","(41.44974, 2.210299, 0.0)",41.44974,2.210299,0.0
858,Spain,Bierzo,White Blend,89.0,"Bierzo, Spain","El Bierzo, Ponferrada, Castilla y León, España","(42.65265025, -6.62318404217132, 0.0)",42.65265025,-6.62318404217132,0.0
859,Spain,Bizkaiko Txakolina,White Blend,87.5,"Bizkaiko Txakolina, Spain","Txakolina Ameztoy, 102, Autopista del Cantábrico / Kantauriko Autobidea, Hiruerreketa, Zarautz, Urola-Kosta, Gipuzkoa, Euskadi, 20800, España","(43.2811054, -2.1793064, 0.0)",43.2811054,-2.1793064,0.0
860,Spain,Bullas,Monastrell,86.0,"Bullas, Spain","Bullas, Noroeste, Región de Murcia, 30180, España","(38.0497852, -1.6703391, 0.0)",38.0497852,-1.6703391,0.0
861,Spain,Calatayud,Tempranillo,86.0,"Calatayud, Spain","Calatayud, Comunidad de Calatayud, Zaragoza, Aragón, 50300, España","(41.3527628, -1.6422977, 0.0)",41.3527628,-1.6422977,0.0
862,Spain,Campo de Borja,White Blend,91.0,"Campo de Borja, Spain","Campo de Borja, Zaragoza, Aragón, España","(41.78654145, -1.5058322706803928, 0.0)",41.78654145,-1.5058322706803928,0.0
863,Spain,Cariñena,White Blend,89.0,"Cariñena, Spain","Cariñena, Campo de Cariñena, Zaragoza, Aragón, 50400, España","(41.3377248, -1.2248826, 0.0)",41.3377248,-1.2248826,0.0
864,Spain,Castilla La Mancha,Sauvignon Blanc-Verdejo,84.0,"Castilla La Mancha, Spain","Castilla-La Mancha, España","(39.4177902, -2.6232332, 0.0)",39.4177902,-2.6232332,0.0
865,Spain,Catalonia,White Blend,87.0,"Catalonia, Spain","Catalunya, España","(41.8523094, 1.5745043, 0.0)",41.8523094,1.5745043,0.0
866,Spain,Catalunya,Xarel-lo,89.0,"Catalunya, Spain","Catalunya, España","(41.8523094, 1.5745043, 0.0)",41.8523094,1.5745043,0.0
867,Spain,Cava,Xarel-lo,90.0,"Cava, Spain","Cava, Alt Urgell, Lleida, Catalunya, 25722, España","(42.31658175, 1.6111496867672197, 0.0)",42.31658175,1.6111496867672197,0.0
868,Spain,Cigales,Tinto del Pais,91.0,"Cigales, Spain","Cigales, Valladolid, Castilla y León, 47270, España","(41.7582863, -4.6989785, 0.0)",41.7582863,-4.6989785,0.0
869,Spain,Conca de Barberà,White Blend,90.5,"Conca de Barberà, Spain","Conca de Barberà, Tarragona, Catalunya, España","(41.44389565, 1.1885113323042593, 0.0)",41.44389565,1.1885113323042593,0.0
870,Spain,Costers del Segre,White Blend,90.0,"Costers del Segre, Spain","Celler Purgatori. Torres. Costers del Segre, C-233, Castelldans, Garrigues, Lleida, Catalunya, 25154, España","(41.502298249999996, 0.8273990115524253, 0.0)",41.502298249999996,0.8273990115524253,0.0
871,Spain,Dominio de Valdepusa,Syrah,92.0,"Dominio de Valdepusa, Spain",,,,,
872,Spain,Emporadà-Costa Brava,Red Blend,88.5,"Emporadà-Costa Brava, Spain",,,,,
873,Spain,Empordà,White Blend,88.0,"Empordà, Spain","Empordá, Autopista de la Mediterrània, el Barri de l'Església, Ermedàs, Garrigàs, Alt Empordà, Girona, Catalunya, 17483, España","(42.173833, 2.931806, 0.0)",42.173833,2.931806,0.0
874,Spain,Extremadura,White Blend,88.0,"Extremadura, Spain","Extremadura, España","(39.1748426, -6.1529891, 0.0)",39.1748426,-6.1529891,0.0
875,Spain,Finca Élez,Red Blend,85.0,"Finca Élez, Spain",,,,,
876,Spain,Getariako Txakolina,White Blend,88.0,"Getariako Txakolina, Spain",,,,,
877,Spain,Jerez,Sherry,92.0,"Jerez, Spain","Jerez de la Frontera, Campiña de Jerez, Andalucía, España","(36.6816936, -6.1377402, 0.0)",36.6816936,-6.1377402,0.0
878,Spain,Jumilla,White Blend,90.0,"Jumilla, Spain","Jumilla, Altiplano, Región de Murcia, España","(38.4734708, -1.3285448, 0.0)",38.4734708,-1.3285448,0.0
879,Spain,La Mancha,White Blend,90.0,"La Mancha, Spain","La Mancha, Castillejo de Martín Viejo, Ciudad Rodrigo, Castilla y León, España","(40.726618, -6.570641, 0.0)",40.726618,-6.570641,0.0
880,Spain,Lanzarote,Rosado,86.0,"Lanzarote, Spain","Lanzarote, Teguise, Las Palmas, Canarias, España","(29.03970805, -13.636291608604138, 0.0)",29.03970805,-13.636291608604138,0.0
881,Spain,Madrid,Red Blend,85.0,"Madrid, Spain","Madrid, Área metropolitana de Madrid y Corredor del Henares, Comunidad de Madrid, 28001, España","(40.4167047, -3.7035825, 0.0)",40.4167047,-3.7035825,0.0
882,Spain,Manchuela,Touriga Nacional Blend,91.0,"Manchuela, Spain","La Manchuela, Villarrobledo, Albacete, Castilla-La Mancha, España","(39.2939397, -2.5269091, 0.0)",39.2939397,-2.5269091,0.0
883,Spain,Mentrida,Red Blend,91.0,"Mentrida, Spain","Méntrida, Torrijos, Toledo, Castilla-La Mancha, 45930, España","(40.2379032, -4.1945535, 0.0)",40.2379032,-4.1945535,0.0
884,Spain,Monterrei,Mencía,86.0,"Monterrei, Spain","Monterrei, Verín, Ourense, Galicia / Galiza, 32619, España","(41.9467657, -7.4491474, 0.0)",41.9467657,-7.4491474,0.0
885,Spain,Montilla-Moriles,Pedro Ximénez,91.0,"Montilla-Moriles, Spain","Calle Montilla Moriles, Rincón de la Victoria, La Axarquía, Málaga, Andalucía, 29730, España","(36.7289133, -4.2997395, 0.0)",36.7289133,-4.2997395,0.0
886,Spain,Montsant,White Blend,89.5,"Montsant, Spain","Montsant, Carrer del Riu Montsant, Torreforta, Tarragona, Tarragonès, Tarragona, Catalunya, 43001, España","(41.117055, 1.2110712, 0.0)",41.117055,1.2110712,0.0
887,Spain,Málaga,White Blend,91.0,"Málaga, Spain","Málaga, Málaga-Costa del Sol, Málaga, Andalucía, España","(36.7213028, -4.4216366, 0.0)",36.7213028,-4.4216366,0.0
888,Spain,Navarra,White Blend,88.0,"Navarra, Spain","Navarra - Nafarroa, España","(42.61254875, -1.830787682991546, 0.0)",42.61254875,-1.830787682991546,0.0
889,Spain,Pago de Arínzano,Tempranillo-Merlot,92.0,"Pago de Arínzano, Spain",,,,,
890,Spain,Penedès,Xarel-lo,89.0,"Penedès, Spain","PENEDÉS, 208, Autopista de la Mediterrània, l'Arboç, Baix Penedès, Tarragona, Catalunya, 43720, España","(41.2890658, 1.5895489, 0.0)",41.2890658,1.5895489,0.0
891,Spain,Pla de Bages,White Blend,91.0,"Pla de Bages, Spain","Pla de Bages, Eix Transversal, la Sala de Sant Ponç, Sallent, Bages, Barcelona, Catalunya, 08650, España","(41.7785429, 1.8904077, 0.0)",41.7785429,1.8904077,0.0
892,Spain,Priorat,White Blend,94.0,"Priorat, Spain","Priorat, Tarragona, Catalunya, España","(41.2137983, 0.811623628426715, 0.0)",41.2137983,0.811623628426715,0.0
893,Spain,Ribeira Sacra,White Blend,89.0,"Ribeira Sacra, Spain","Ribeira Sacra, 5, Estrada de Esgos, Mundin, Nogueira de Ramuín, Ourense, Galicia / Galiza, 32160, España","(42.4102859, -7.7261862, 0.0)",42.4102859,-7.7261862,0.0
894,Spain,Ribeiro,White Blend,88.5,"Ribeiro, Spain","O Ribeiro, Ourense, Galicia / Galiza, España","(42.31990645, -8.152266856014716, 0.0)",42.31990645,-8.152266856014716,0.0
895,Spain,Ribera del Duero,Tinto del Pais,95.0,"Ribera del Duero, Spain","Aranda de Duero, Castilla y León, España","(41.675622000000004, -3.726459680944383, 0.0)",41.675622000000004,-3.726459680944383,0.0
896,Spain,Ribera del Guadiana,White Blend,85.5,"Ribera del Guadiana, Spain",,,,,
897,Spain,Ribera del Júcar,Tempranillo,86.0,"Ribera del Júcar, Spain","Colegio Público Ribera del Júcar, Avenida Madrid Valencia, Valverde de Júcar, Cuenca, Castilla-La Mancha, España","(39.71485335, -2.2189574752981764, 0.0)",39.71485335,-2.2189574752981764,0.0
898,Spain,Rioja,White Blend,89.0,"Rioja, Spain","La Rioja, España","(42.3285528, -2.4674917, 0.0)",42.3285528,-2.4674917,0.0
899,Spain,Rueda,White Blend,87.0,"Rueda, Spain","Rueda, Tordesillas, Castilla y León, España","(41.4129785, -4.9597533, 0.0)",41.4129785,-4.9597533,0.0
900,Spain,Rías Baixas,White Blend,88.0,"Rías Baixas, Spain","Rías Baixas, Calle de José Cadalso, El Castillo, Torrejón de Ardoz, Área metropolitana de Madrid y Corredor del Henares, Comunidad de Madrid, 28038, España","(40.443237, -3.4617837, 0.0)",40.443237,-3.4617837,0.0
901,Spain,Sardon de Duero,Tempranillo Blend,93.0,"Sardon de Duero, Spain","Sardón de Duero, Valladolid, Castilla y León, España","(41.6085193, -4.4339323, 0.0)",41.6085193,-4.4339323,0.0
902,Spain,Sierra de Salamanca,White Blend,88.0,"Sierra de Salamanca, Spain","La Sierra, La Rinconada de la Sierra, La Alberca, Castilla y León, 37607, España","(40.6065982, -6.0387627, 0.0)",40.6065982,-6.0387627,0.0
903,Spain,Somontano,White Blend,90.5,"Somontano, Spain","Somontano de Barbastro, Huesca, Aragón, España","(42.0883878, 0.09940412890672314, 0.0)",42.0883878,0.09940412890672314,0.0
904,Spain,Spain,White Blend,92.0,"Spain, Spain",España,"(39.3262345, -4.8380649, 0.0)",39.3262345,-4.8380649,0.0
905,Spain,Tarragona,Red Blend,90.0,"Tarragona, Spain","Tarragona, Tarragonès, Tarragona, Catalunya, 43001, España","(41.1172364, 1.2546057, 0.0)",41.1172364,1.2546057,0.0
906,Spain,Terra Alta,White Blend,88.0,"Terra Alta, Spain","Terra Alta, Tarragona, Catalunya, España","(41.027352300000004, 0.4105997375190444, 0.0)",41.027352300000004,0.4105997375190444,0.0
907,Spain,Tierra de Castilla,Tempranillo-Garnacha,87.0,"Tierra de Castilla, Spain","La Tierra, Santo Domingo de Silos, Covarrubias, Castilla y León, España","(41.9533522, -3.4780483, 0.0)",41.9533522,-3.4780483,0.0
908,Spain,Tierra de León,Prieto Picudo,85.0,"Tierra de León, Spain","La Tierra, Santo Domingo de Silos, Covarrubias, Castilla y León, España","(41.9533522, -3.4780483, 0.0)",41.9533522,-3.4780483,0.0
909,Spain,Tierra del Viños de Zamora,Tempranillo,91.0,"Tierra del Viños de Zamora, Spain",,,,,
910,Spain,Toledo,Verdejo-Sauvignon Blanc,84.0,"Toledo, Spain","Toledo, Castilla-La Mancha, España","(39.8560679, -4.0239568, 0.0)",39.8560679,-4.0239568,0.0
